question_id,lesson_id,question_type,question_text_bm,question_text_en,level
197,14,mcq,Apakah yang perlu dilakukan jika seseorang tertidur dan terlepas solat fardu?,What should be done if someone sleeps through and misses an obligatory prayer?,2
198,14,mcq,Solat sunat boleh dilakukan pada bila-bila masa kecuali dalam waktu yang dilarang. Bila waktu larangan ini?,Voluntary prayers can be performed at any time except during forbidden times. When are these times?,2
199,14,mcq,Apakah solat sunat yang dianjurkan dilakukan secara berjemaah di bulan Ramadan?,Which voluntary prayer is recommended to be performed in congregation during Ramadan?,2
200,14,mcq,Apakah kelebihan melakukan solat sunat Tahajjud?,What is the benefit of performing the Tahajjud prayer?,2
201,14,mcq,Bilakah waktu terbaik untuk menunaikan solat Dhuha?,When is the best time to perform Dhuha prayer?,2
202,14,mcq,Berapakah jumlah rakaat minimum solat sunat Rawatib?,What is the minimum number of rak'ahs for Rawatib voluntary prayers?,2
203,14,mcq,Apakah solat sunat yang dilakukan untuk memohon petunjuk daripada Allah sebelum membuat keputusan?,Which voluntary prayer is performed to seek guidance from Allah before making a decision?,2
204,14,mcq,"Jika seseorang tidak mampu menunaikan solat berdiri, apakah yang harus dilakukan?","If a person is unable to perform prayer while standing, what should they do?",2
205,14,mcq,Manakah solat yang boleh dilakukan sebagai qada'?,Which prayer can be performed as qada' (make-up prayer)?,2
206,14,binary,"Jika seseorang terlupa solat Witir selepas Isyak, dia boleh mengqada'nya sebelum Subuh.","If someone forgets to perform Witir after Isha, they can make it up before Fajr.",2
207,14,binary,"Solat sunat Rawatib hanya boleh dilakukan selepas solat fardu, bukan sebelumnya.","Rawatib voluntary prayers can only be performed after obligatory prayers, not before.",2
208,14,binary,Solat sunat boleh dilakukan walaupun tanpa wudhu.,Voluntary prayers can be performed even without wudhu.,2
209,14,binary,Solat sunat Dhuha hanya boleh dilakukan sebelum Subuh.,Dhuha prayer can only be performed before Fajr.,2
210,14,binary,Solat sunat Tahajjud hanya boleh dilakukan selepas tidur.,Tahajjud prayer can only be performed after sleeping.,2
211,15,mcq,Apakah syarat wajib berpuasa Ramadan?,What are the requirements for fasting in Ramadan?,2
212,15,mcq,Apakah perkara yang boleh membatalkan puasa?,Which of the following invalidates the fast?,2
213,15,mcq,"Jika seseorang makan atau minum kerana terlupa, apakah hukumnya?","If someone eats or drinks by mistake while fasting, what is the ruling?",2
214,15,mcq,Apakah keutamaan bersahur?,What is the significance of having suhoor?,2
215,15,mcq,Apakah yang perlu dilakukan jika jatuh sakit dan tidak mampu berpuasa?,What should be done if someone falls ill and is unable to fast?,2
216,15,mcq,Malam apakah yang lebih baik daripada 1000 bulan dan disambut dalam bulan Ramadan?,Which night in Ramadan is better than 1000 months?,2
217,15,mcq,Apakah amalan sunat ketika berpuasa?,What are the recommended acts while fasting?,2
218,15,mcq,Bagaimana cara menggantikan puasa bagi orang yang uzur seperti sakit kronik atau tua?,How should a person with a chronic illness or old age compensate for missed fasting?,2
219,15,mcq,Apakah kelebihan berpuasa di bulan Ramadan?,What is the benefit of fasting in Ramadan?,2
220,15,binary,Niat berpuasa boleh dilakukan dalam hati tanpa perlu dilafazkan secara kuat.,The intention to fast can be made in the heart without being verbally expressed.,2
221,15,binary,Wanita yang sedang haid atau nifas tidak perlu berpuasa dan wajib menggantikannya selepas Ramadan.,Women who are menstruating or experiencing postpartum bleeding do not have to fast and must make up for it after Ramadan.,2
222,15,binary,Berkumur dan memasukkan air ke dalam hidung ketika berwudhu semasa berpuasa boleh membatalkan puasa.,Rinsing the mouth and putting water into the nose while performing wudhu during fasting can break the fast.,2
223,15,binary,Puasa boleh dibatalkan jika seseorang jatuh sakit dan tidak mampu meneruskannya.,Fasting can be broken if someone falls ill and is unable to continue.,2
224,15,binary,Malam Lailatul Qadar hanya berlaku pada 10 malam terakhir Ramadan.,The Night of Qadr (Lailatul Qadr) only occurs in the last 10 nights of Ramadan.,2
225,15,binary,Tidur sepanjang hari tanpa melakukan ibadah ketika berpuasa adalah amalan yang digalakkan.,Sleeping all day without engaging in worship while fasting is encouraged.,2
